{
  "schema": "xcodebuildmcp.output.capture-result",
  "schemaVersion": "2",
  "didError": false,
  "error": null,
  "data": {
    "summary": {
      "status": "SUCCEEDED"
    },
    "artifacts": {
      "simulatorId": "<UUID>"
    },
    "capture": {
      "type": "ui-hierarchy",
      "uiHierarchy": [
        {
          "AXFrame": "{{0, 0}, {402, 874}}",
          "AXUniqueId": null,
          "frame": { "x": 0, "y": 0, "width": 402, "height": 874 },
          "role_description": "application",
          "AXLabel": "Calculator",
          "content_required": false,
          "type": "Application",
          "title": null,
          "help": null,
          "custom_actions": [],
          "AXValue": null,
          "enabled": true,
          "role": "AXApplication",
          "children": [
            {
              "AXFrame": "{{344, 250.5}, {34, 67}}",
              "AXUniqueId": null,
              "frame": { "x": 344, "y": 250.5, "width": 34, "height": 67 },
              "role_description": "text",
              "AXLabel": "0",
              "content_required": false,
              "type": "StaticText",
              "title": null,
              "help": null,
              "custom_actions": [],
              "AXValue": null,
              "enabled": true,
              "role": "AXStaticText",
              "children": [],
              "subrole": null,
              "pid": 99999
            },
            {
              "AXFrame": "{{19.5, 357.5}, {82.7, 81}}",
              "AXUniqueId": null,
              "frame": { "x": 19.5, "y": 357.5, "width": 82.7, "height": 81 },
              "role_description": "button",
              "AXLabel": "C",
              "content_required": false,
              "type": "Button",
              "title": null,
              "help": null,
              "custom_actions": [],
              "AXValue": null,
              "enabled": true,
              "role": "AXButton",
              "children": [],
              "subrole": null,
              "pid": 99999
            },
            {
              "AXFrame": "{{113.2, 357.5}, {82.3, 81}}",
              "AXUniqueId": null,
              "frame": { "x": 113.2, "y": 357.5, "width": 82.3, "height": 81 },
              "role_description": "button",
              "AXLabel": "±",
              "content_required": false,
              "type": "Button",
              "title": null,
              "help": null,
              "custom_actions": [],
              "AXValue": null,
              "enabled": true,
              "role": "AXButton",
              "children": [],
              "subrole": null,
              "pid": 99999
            },
            {
              "AXFrame": "{{206.5, 357.5}, {82.7, 81}}",
              "AXUniqueId": null,
              "frame": { "x": 206.5, "y": 357.5, "width": 82.7, "height": 81 },
              "role_description": "button",
              "AXLabel": "%",
              "content_required": false,
              "type": "Button",
              "title": null,
              "help": null,
              "custom_actions": [],
              "AXValue": null,
              "enabled": true,
              "role": "AXButton",
              "children": [],
              "subrole": null,
              "pid": 99999
            },
            {
              "AXFrame": "{{300.2, 357.5}, {82.3, 81}}",
              "AXUniqueId": null,
              "frame": { "x": 300.2, "y": 357.5, "width": 82.3, "height": 81 },
              "role_description": "button",
              "AXLabel": "÷",
              "content_required": false,
              "type": "Button",
              "title": null,
              "help": null,
              "custom_actions": [],
              "AXValue": null,
              "enabled": true,
              "role": "AXButton",
              "children": [],
              "subrole": null,
              "pid": 99999
            },
            {
              "AXFrame": "{{19.5, 449.5}, {82.7, 81}}",
              "AXUniqueId": null,
              "frame": { "x": 19.5, "y": 449.5, "width": 82.7, "height": 81 },
              "role_description": "button",
              "AXLabel": "7",
              "content_required": false,
              "type": "Button",
              "title": null,
              "help": null,
              "custom_actions": [],
              "AXValue": null,
              "enabled": true,
              "role": "AXButton",
              "children": [],
              "subrole": null,
              "pid": 99999
            },
            {
              "AXFrame": "{{113.2, 449.5}, {82.3, 81}}",
              "AXUniqueId": null,
              "frame": { "x": 113.2, "y": 449.5, "width": 82.3, "height": 81 },
              "role_description": "button",
              "AXLabel": "8",
              "content_required": false,
              "type": "Button",
              "title": null,
              "help": null,
              "custom_actions": [],
              "AXValue": null,
              "enabled": true,
              "role": "AXButton",
              "children": [],
              "subrole": null,
              "pid": 99999
            },
            {
              "AXFrame": "{{206.5, 449.5}, {82.7, 81}}",
              "AXUniqueId": null,
              "frame": { "x": 206.5, "y": 449.5, "width": 82.7, "height": 81 },
              "role_description": "button",
              "AXLabel": "9",
              "content_required": false,
              "type": "Button",
              "title": null,
              "help": null,
              "custom_actions": [],
              "AXValue": null,
              "enabled": true,
              "role": "AXButton",
              "children": [],
              "subrole": null,
              "pid": 99999
            },
            {
              "AXFrame": "{{300.2, 449.5}, {82.3, 81}}",
              "AXUniqueId": null,
              "frame": { "x": 300.2, "y": 449.5, "width": 82.3, "height": 81 },
              "role_description": "button",
              "AXLabel": "×",
              "content_required": false,
              "type": "Button",
              "title": null,
              "help": null,
              "custom_actions": [],
              "AXValue": null,
              "enabled": true,
              "role": "AXButton",
              "children": [],
              "subrole": null,
              "pid": 99999
            },
            {
              "AXFrame": "{{19.5, 541.5}, {82.7, 81}}",
              "AXUniqueId": null,
              "frame": { "x": 19.5, "y": 541.5, "width": 82.7, "height": 81 },
              "role_description": "button",
              "AXLabel": "4",
              "content_required": false,
              "type": "Button",
              "title": null,
              "help": null,
              "custom_actions": [],
              "AXValue": null,
              "enabled": true,
              "role": "AXButton",
              "children": [],
              "subrole": null,
              "pid": 99999
            },
            {
              "AXFrame": "{{113.2, 541.5}, {82.3, 81}}",
              "AXUniqueId": null,
              "frame": { "x": 113.2, "y": 541.5, "width": 82.3, "height": 81 },
              "role_description": "button",
              "AXLabel": "5",
              "content_required": false,
              "type": "Button",
              "title": null,
              "help": null,
              "custom_actions": [],
              "AXValue": null,
              "enabled": true,
              "role": "AXButton",
              "children": [],
              "subrole": null,
              "pid": 99999
            },
            {
              "AXFrame": "{{206.5, 541.5}, {82.7, 81}}",
              "AXUniqueId": null,
              "frame": { "x": 206.5, "y": 541.5, "width": 82.7, "height": 81 },
              "role_description": "button",
              "AXLabel": "6",
              "content_required": false,
              "type": "Button",
              "title": null,
              "help": null,
              "custom_actions": [],
              "AXValue": null,
              "enabled": true,
              "role": "AXButton",
              "children": [],
              "subrole": null,
              "pid": 99999
            },
            {
              "AXFrame": "{{300.2, 541.5}, {82.3, 81}}",
              "AXUniqueId": null,
              "frame": { "x": 300.2, "y": 541.5, "width": 82.3, "height": 81 },
              "role_description": "button",
              "AXLabel": "-",
              "content_required": false,
              "type": "Button",
              "title": null,
              "help": null,
              "custom_actions": [],
              "AXValue": null,
              "enabled": true,
              "role": "AXButton",
              "children": [],
              "subrole": null,
              "pid": 99999
            },
            {
              "AXFrame": "{{19.5, 633.5}, {82.7, 81}}",
              "AXUniqueId": null,
              "frame": { "x": 19.5, "y": 633.5, "width": 82.7, "height": 81 },
              "role_description": "button",
              "AXLabel": "1",
              "content_required": false,
              "type": "Button",
              "title": null,
              "help": null,
              "custom_actions": [],
              "AXValue": null,
              "enabled": true,
              "role": "AXButton",
              "children": [],
              "subrole": null,
              "pid": 99999
            },
            {
              "AXFrame": "{{113.2, 633.5}, {82.3, 81}}",
              "AXUniqueId": null,
              "frame": { "x": 113.2, "y": 633.5, "width": 82.3, "height": 81 },
              "role_description": "button",
              "AXLabel": "2",
              "content_required": false,
              "type": "Button",
              "title": null,
              "help": null,
              "custom_actions": [],
              "AXValue": null,